{
  "$schema": "https://json-schema.org/draft/2020-12/schema",
  "type": "object",
  "required": [
    "run_id",
    "reviewed_at",
    "contract_file_hash",
    "proposals_file_hash",
    "decisions"
  ],
  "additionalProperties": false,
  "properties": {
    "run_id": {
      "type": "string"
    },
    "reviewed_at": {
      "type": "string",
      "format": "date-time"
    },
    "contract_file_hash": {
      "type": "string",
      "pattern": "^[0-9a-f]{64}$"
    },
    "proposals_file_hash": {
      "type": "string",
      "pattern": "^[0-9a-f]{64}$"
    },
    "decisions": {
      "type": "array",
      "items": {
        "type": "object",
        "required": [
          "proposal_id",
          "decision",
          "reviewer",
          "reason_code"
        ],
        "additionalProperties": false,
        "properties": {
          "proposal_id": {
            "type": "string",
            "pattern": "^P-[0-9]{3,}$"
          },
          "decision": {
            "type": "string",
            "enum": [
              "accepted",
              "rejected",
              "pending_scope_review"
            ]
          },
          "reviewer": {
            "type": "string",
            "minLength": 1
          },
          "reason_code": {
            "type": "string",
            "minLength": 1
          },
          "notes": {
            "type": "string"
          }
        }
      }
    }
  }
}
