{
  "run_id": "phase2-mar17-20260317_141745-bb818649",
  "contract_file_hash": "d7ab68a84baee5fbe0224b1b7f341c4de4ee3aaad0f350ec90471e0fb8cd4f7c",
  "proposals_file_hash": "ba9d219a96e093411939e86944555dfea8a96610bd60e8bdc04fb7a10c1ed5a0",
  "reviewed_at": "2026-03-17T15:45:00Z",
  "decisions": [
    {
      "proposal_id": "P-100",
      "decision": "accepted",
      "reviewer": "human+claude",
      "reason_code": "P0_safety_gap",
      "notes": "Margin Headroom Gate has no fail-closed for NaN/missing inputs. Clear avoidable-loss path."
    },
    {
      "proposal_id": "P-101",
      "decision": "accepted",
      "reviewer": "human+claude",
      "reason_code": "missing_at_coverage",
      "notes": "drain_all() 3 normative MUSTs (Kill-only guard, post-drain settle=false, pre-drain TLSMs terminal) have zero AT coverage."
    },
    {
      "proposal_id": "P-102",
      "decision": "accepted",
      "reviewer": "human+claude",
      "reason_code": "missing_at_coverage",
      "notes": "Pricer fail-closed on NaN/missing has no AT proving dispatch_count=0. AT-223 is happy-path only."
    },
    {
      "proposal_id": "P-103",
      "decision": "accepted",
      "reviewer": "human+claude",
      "reason_code": "weak_normative_repair",
      "notes": "SELL-when-long formula is vague while BUY side has exact formula. inventory_skew_sell_floor=0.5 is the mirror-symmetric default under current contract parameters."
    },
    {
      "proposal_id": "P-104",
      "decision": "accepted",
      "reviewer": "human+claude",
      "reason_code": "cross_ref_dedup",
      "notes": "Verbatim duplicate Recovery/Matching Rule at two locations. CSP-063 anchor + cross-ref prevents divergence."
    },
    {
      "proposal_id": "P-105",
      "decision": "accepted",
      "reviewer": "human+claude",
      "reason_code": "staleness_gap",
      "notes": "Margin Headroom is the only gate without staleness TTL. 5000ms default aligns with all other staleness-sensitive subsystems."
    },
    {
      "proposal_id": "P-200",
      "decision": "accepted",
      "reviewer": "human+claude",
      "reason_code": "P0_unimplementable",
      "notes": "bunker_mode_active has no timestamp field and no freshness threshold. AT-1249 is unimplementable without these fields."
    },
    {
      "proposal_id": "P-201",
      "decision": "accepted",
      "reviewer": "human+claude",
      "reason_code": "missing_at_coverage",
      "notes": "MUST-level dual-name aliasing rule (contract v5.2) with zero test coverage."
    },
    {
      "proposal_id": "P-202",
      "decision": "accepted",
      "reviewer": "human+claude",
      "reason_code": "mechanical_shall_to_must",
      "notes": "SHALL->MUST at line 412. Non-negotiable computation rule; SHALL weaker than MUST under RFC 2119."
    },
    {
      "proposal_id": "P-203",
      "decision": "accepted",
      "reviewer": "human+claude",
      "reason_code": "cross_ref_missing_token",
      "notes": "TradingModeBlockedOpen not in 29-entry registry. AT-931 references non-existent token. AT-1101 completeness violated."
    },
    {
      "proposal_id": "P-204",
      "decision": "accepted",
      "reviewer": "human+claude",
      "reason_code": "mechanical_duplicate_id",
      "notes": "Two AT-1243 at lines 3011 and 3094 are completely different tests. Renumber second to AT-1253."
    },
    {
      "proposal_id": "P-205",
      "decision": "accepted",
      "reviewer": "human+claude",
      "reason_code": "missing_at_coverage",
      "notes": "fee_model_cache_age_s > fee_model_hard_stale_s -> REDUCEONLY_FEE_MODEL_HARD_STALE has no AT."
    },
    {
      "proposal_id": "P-206",
      "decision": "accepted",
      "reviewer": "human+claude",
      "reason_code": "fail_open_risk",
      "notes": "cortex_override drives ForceKill/ForceReduceOnly but has no missing/unparseable handling. Dropped ForceKill is a capital-loss path."
    },
    {
      "proposal_id": "P-207",
      "decision": "accepted",
      "reviewer": "human+claude",
      "reason_code": "missing_at_coverage",
      "notes": "MUST-level rule (REST failure -> latch stays set) with no AT. Separate code path from AT-1100."
    },
    {
      "proposal_id": "P-208",
      "decision": "accepted",
      "reviewer": "human+claude",
      "reason_code": "missing_at_coverage_rewritten",
      "notes": "Recovery Rule AT rewritten to bind to bunker_mode_active + bunker_exit_stable_s. Sole-cause: all other axis inputs nominal; pass requires ReduceOnly held for full stable-exit window."
    },
    {
      "proposal_id": "P-209",
      "decision": "rejected",
      "reviewer": "human+claude",
      "reason_code": "already_rejected",
      "notes": "Pre-rejected by harness. Parenthetical qualifier is sufficient; unconditional cooldown + reconcile pattern covers single trigger source."
    },
    {
      "proposal_id": "P-210",
      "decision": "accepted",
      "reviewer": "human+claude",
      "reason_code": "mechanical_shall_to_must",
      "notes": "SHALL->MUST at line 513. Same finding F-202, second location."
    },
    {
      "proposal_id": "P-400",
      "decision": "rejected",
      "reviewer": "human+claude",
      "reason_code": "fixture_only_not_contract",
      "notes": "Sample fixture proposal — replace_span targets fixture text, not CONTRACT.md. Fix recorded in fixture patched output."
    },
    {
      "proposal_id": "P-401",
      "decision": "rejected",
      "reviewer": "human+claude",
      "reason_code": "fixture_only_not_contract",
      "notes": "Sample fixture proposal — replace_span targets fixture text, not CONTRACT.md. Fix recorded in fixture patched output."
    }
  ]
}
